{
  "counts": {
    "features_by_proof": {
      "no-test": 46,
      "tested": 20
    },
    "issues_by_state": {
      "awaiting-test": 2,
      "built": 9,
      "in-progress": 5,
      "planned": 2,
      "ready": 4,
      "released": 0
    }
  },
  "features": [
    {
      "area": "access",
      "ci": null,
      "commands": [],
      "id": "access-contrast-and-target-size",
      "issues": [],
      "listed_status": "browser",
      "mcp_tools": [],
      "merges": [],
      "missing_tests": [],
      "proof": "tested",
      "state": "unlinked",
      "tests": [
        {
          "file": "crates/ui-egui/src/e2e/shell.rs",
          "name": "a_newcomer_never_meets_a_control_too_small_to_hit"
        },
        {
          "file": "crates/ui-egui/src/contrast.rs",
          "name": "every_theme_meets_contrast_minimums"
        }
      ],
      "title": "Contrast and target size"
    },
    {
      "area": "access",
      "ci": null,
      "commands": [],
      "id": "access-keyboard-use",
      "issues": [],
      "listed_status": "browser",
      "mcp_tools": [],
      "merges": [],
      "missing_tests": [],
      "proof": "tested",
      "state": "unlinked",
      "tests": [
        {
          "file": "crates/ui-egui/src/e2e/shell.rs",
          "name": "a_newcomer_opens_settings_from_the_app_bar_with_the_keyboard_only"
        },
        {
          "file": "crates/ui-egui/src/e2e/shell.rs",
          "name": "a_newcomer_switches_view_with_the_keyboard_only"
        }
      ],
      "title": "Keyboard use"
    },
    {
      "area": "access",
      "ci": null,
      "commands": [],
      "id": "access-names-for-every-control",
      "issues": [],
      "listed_status": "browser",
      "mcp_tools": [],
      "merges": [],
      "missing_tests": [],
      "proof": "tested",
      "state": "unlinked",
      "tests": [
        {
          "file": "crates/ui-egui/src/e2e/shell.rs",
          "name": "every_interactive_control_has_an_accessible_name"
        }
      ],
      "title": "Names for every control"
    },
    {
      "area": "access",
      "ci": null,
      "commands": [],
      "id": "access-reduced-motion",
      "issues": [],
      "listed_status": "browser",
      "mcp_tools": [],
      "merges": [],
      "missing_tests": [],
      "proof": "tested",
      "state": "unlinked",
      "tests": [
        {
          "file": "crates/ui-egui/src/motion.rs",
          "name": "reduced_motion_survives_a_preferences_round_trip"
        }
      ],
      "title": "Reduced motion"
    },
    {
      "area": "access",
      "ci": null,
      "commands": [],
      "id": "access-screen-reader-announcements",
      "issues": [],
      "listed_status": "browser",
      "mcp_tools": [],
      "merges": [],
      "missing_tests": [],
      "proof": "tested",
      "state": "unlinked",
      "tests": [
        {
          "file": "crates/ui-egui/src/e2e/shell.rs",
          "name": "a_newcomer_with_a_screen_reader_hears_the_status_after_a_command"
        },
        {
          "file": "crates/ui-egui/src/e2e/shell.rs",
          "name": "an_unchanged_message_is_not_announced_twice"
        }
      ],
      "title": "Screen reader announcements"
    },
    {
      "area": "access",
      "ci": null,
      "commands": [],
      "id": "access-your-language",
      "issues": [],
      "listed_status": "browser",
      "mcp_tools": [],
      "merges": [],
      "missing_tests": [],
      "proof": "tested",
      "state": "unlinked",
      "tests": [
        {
          "file": "crates/ui-egui/src/e2e/shell.rs",
          "name": "a_newcomer_switches_the_app_to_their_language"
        }
      ],
      "title": "Your language"
    },
    {
      "area": "assistant",
      "ci": null,
      "commands": [],
      "id": "assistant-assistant-panel",
      "issues": [],
      "listed_status": "desktop",
      "mcp_tools": [],
      "merges": [],
      "missing_tests": [],
      "proof": "tested",
      "state": "unlinked",
      "tests": [
        {
          "file": "crates/ui-egui/src/e2e/assistant.rs",
          "name": "a_newcomer_asks_the_assistant_to_add_a_resistor"
        },
        {
          "file": "crates/ui-egui/src/e2e/assistant.rs",
          "name": "a_newcomer_opens_the_assistant_and_is_told_how_to_connect_a_model"
        }
      ],
      "title": "Assistant panel"
    },
    {
      "area": "assistant",
      "ci": null,
      "commands": [],
      "id": "assistant-batches-preview-and-undo",
      "issues": [],
      "listed_status": "browser",
      "mcp_tools": [
        "batch",
        "dry_run",
        "undo"
      ],
      "merges": [],
      "missing_tests": [],
      "proof": "no-test",
      "state": "unlinked",
      "tests": [],
      "title": "Batches, preview and undo"
    },
    {
      "area": "assistant",
      "ci": null,
      "commands": [],
      "id": "assistant-command-line",
      "issues": [],
      "listed_status": "desktop",
      "mcp_tools": [],
      "merges": [],
      "missing_tests": [],
      "proof": "no-test",
      "state": "unlinked",
      "tests": [],
      "title": "Command line"
    },
    {
      "area": "assistant",
      "ci": null,
      "commands": [],
      "id": "assistant-local-model-servers",
      "issues": [],
      "listed_status": "desktop",
      "mcp_tools": [],
      "merges": [],
      "missing_tests": [],
      "proof": "tested",
      "state": "unlinked",
      "tests": [
        {
          "file": "crates/ui-egui/src/e2e/assistant.rs",
          "name": "a_newcomer_adds_a_local_model_server_and_tests_it"
        }
      ],
      "title": "Local model servers"
    },
    {
      "area": "assistant",
      "ci": null,
      "commands": [],
      "id": "assistant-mcp-server",
      "issues": [],
      "listed_status": "desktop",
      "mcp_tools": [
        "list_commands"
      ],
      "merges": [],
      "missing_tests": [],
      "proof": "no-test",
      "state": "unlinked",
      "tests": [],
      "title": "MCP server"
    },
    {
      "area": "assistant",
      "ci": null,
      "commands": [],
      "id": "assistant-you-approve-every-change",
      "issues": [],
      "listed_status": "desktop",
      "mcp_tools": [],
      "merges": [],
      "missing_tests": [],
      "proof": "tested",
      "state": "unlinked",
      "tests": [
        {
          "file": "crates/ui-egui/src/e2e/assistant.rs",
          "name": "a_newcomer_allows_two_changes_and_takes_them_back_with_one_undo"
        },
        {
          "file": "crates/ui-egui/src/e2e/assistant.rs",
          "name": "a_newcomer_denies_a_change_and_the_design_stays_as_it_was"
        }
      ],
      "title": "You approve every change"
    },
    {
      "area": "browser",
      "ci": null,
      "commands": [
        "project.export_archive"
      ],
      "id": "browser-project-archive",
      "issues": [],
      "listed_status": "desktop",
      "mcp_tools": [],
      "merges": [],
      "missing_tests": [],
      "proof": "no-test",
      "state": "unlinked",
      "tests": [],
      "title": "Project archive"
    },
    {
      "area": "browser",
      "ci": null,
      "commands": [],
      "id": "browser-runs-in-a-browser-tab",
      "issues": [],
      "listed_status": "browser",
      "mcp_tools": [],
      "merges": [],
      "missing_tests": [],
      "proof": "no-test",
      "state": "unlinked",
      "tests": [],
      "title": "Runs in a browser tab"
    },
    {
      "area": "browser",
      "ci": null,
      "commands": [],
      "id": "browser-sample-design",
      "issues": [],
      "listed_status": "browser",
      "mcp_tools": [
        "sample_design"
      ],
      "merges": [],
      "missing_tests": [],
      "proof": "no-test",
      "state": "unlinked",
      "tests": [],
      "title": "Sample design"
    },
    {
      "area": "layout",
      "ci": null,
      "commands": [
        "board.fiducial_place"
      ],
      "id": "layout-assembly-marks",
      "issues": [],
      "listed_status": "browser",
      "mcp_tools": [],
      "merges": [],
      "missing_tests": [],
      "proof": "tested",
      "state": "unlinked",
      "tests": [
        {
          "file": "crates/ui-egui/src/e2e/shell.rs",
          "name": "a_newcomer_adds_assembly_marks_for_the_build_camera"
        }
      ],
      "title": "Assembly marks"
    },
    {
      "area": "layout",
      "ci": null,
      "commands": [
        "variant.create"
      ],
      "id": "layout-assembly-variants",
      "issues": [],
      "listed_status": "browser",
      "mcp_tools": [],
      "merges": [],
      "missing_tests": [],
      "proof": "tested",
      "state": "unlinked",
      "tests": [
        {
          "file": "crates/ui-egui/src/e2e/builds.rs",
          "name": "a_newcomer_describes_a_build_that_leaves_a_part_off"
        }
      ],
      "title": "Assembly variants"
    },
    {
      "area": "layout",
      "ci": null,
      "commands": [
        "zone.pour",
        "zone.fill"
      ],
      "id": "layout-copper-zones",
      "issues": [],
      "listed_status": "browser",
      "mcp_tools": [],
      "merges": [],
      "missing_tests": [],
      "proof": "no-test",
      "state": "unlinked",
      "tests": [],
      "title": "Copper zones"
    },
    {
      "area": "layout",
      "ci": null,
      "commands": [
        "track.route_pair"
      ],
      "id": "layout-differential-pairs",
      "issues": [],
      "listed_status": "browser",
      "mcp_tools": [],
      "merges": [],
      "missing_tests": [],
      "proof": "tested",
      "state": "unlinked",
      "tests": [
        {
          "file": "crates/ui-egui/src/e2e/pairs.rs",
          "name": "a_newcomer_routes_a_pair_in_one_drag"
        }
      ],
      "title": "Differential pairs"
    },
    {
      "area": "layout",
      "ci": null,
      "commands": [
        "footprint.dock_edge",
        "footprint.set_castellated"
      ],